{
  "$schema": "https://json-schema.org/draft/2020-12/schema",
  "$id": "https://company-harness.local/schema/context-record",
  "title": "Kontextdatensatz",
  "description": "Ein akzeptierter Fakt aus dem kuratierten Korpus. ohne source und stand gibt es keinen Fakt; widersprüchliche Angaben bleiben zwei Datensätze.",
  "type": "object",
  "additionalProperties": false,
  "required": [
    "id", "kind", "statement", "source", "stand", "owner", "scope", "status", "synthetisch"
  ],
  "properties": {
    "id": { "type": "string", "pattern": "^[a-zäöüß0-9]+(-[a-zäöüß0-9]+)*$" },
    "kind": { "enum": ["agreement", "capacity", "rule", "acceptance", "commitment", "fact"] },
    "statement": { "type": "string", "minLength": 8 },
    "source": { "type": "string", "minLength": 1, "description": "Pfad auf ein Dokument im Korpus. Der Validator prüft, dass es existiert." },
    "stand": { "type": "string", "pattern": "^\\d{4}-\\d{2}-\\d{2}$", "format": "datum" },
    "owner": { "type": "string", "pattern": "^(rolle|person):[^ ]+$" },
    "scope": {
      "type": "array", "minItems": 1, "items": { "type": "string", "minLength": 3 },
      "description": "Zugriffsgrenze, z. B. fall:CHANGE-01. Leerer scope ist kein Allzugriff, sondern ein Fehler."
    },
    "status": { "enum": ["belegt", "ungeprüft", "OFFEN"] },
    "synthetisch": { "const": true, "description": "Pflichtfeld: Erfundenes steht als erfunden im Datensatz selbst, nicht nur in einem Begleitdokument." },
    "valid_until": { "type": ["string", "null"], "pattern": "^\\d{4}-\\d{2}-\\d{2}$", "format": "datum" },
    "supersedes": { "type": ["string", "null"] }
  }
}
