{
  "id": "regel-termin-nur-schriftlich",
  "kind": "rule",
  "statement": "Eine Terminverschiebung bedarf der schriftlichen Bestätigung des Auftraggebers.",
  "source": "prototype/context/quellen/regelwerk-aenderungen-und-rechnungen.md",
  "stand": "2026-08-05",
  "owner": "rolle:inhaber",
  "scope": ["fall:CHANGE-01"],
  "status": "belegt",
  "synthetisch": true
}
