{
  "id": "kulanz-veldt-nicht-dokumentiert",
  "kind": "fact",
  "statement": "Für PRJ-VELD-1 sind zum Stand 2026-09-19 keine Kulanzen dokumentiert. Die Abwesenheit ist im Auftrag vermerkt und nicht aus Schweigen gefolgert.",
  "source": "prototype/context/quellen/veldt-auftrag-2026-05-19.md",
  "stand": "2026-09-19",
  "owner": "rolle:inhaber",
  "scope": ["fall:CHANGE-02"],
  "status": "belegt",
  "synthetisch": true
}
