{
  "id": "regel-aenderung-ab-05-pt",
  "kind": "rule",
  "statement": "Änderungsaufträge ab 0,5 PT werden nachgefordert. Darunter darf die Projektleitung aus dem vereinbarten Volumen entscheiden; die Entscheidung wird vermerkt. Ein Wunsch des Auftraggebers ist für sich genommen keine Umfangsänderung.",
  "source": "prototype/context/quellen/regelwerk-aenderungen-und-rechnungen.md",
  "stand": "2026-08-05",
  "owner": "rolle:inhaber",
  "scope": ["fall:CHANGE-01", "fall:CHANGE-02"],
  "status": "belegt",
  "synthetisch": true
}
