{
  "id": "agr-kest-modul3-nicht-beauftragt",
  "kind": "agreement",
  "statement": "Modul 3 (Export und Berichtslegung) wurde am 2026-03-30 mit 6 PT benannt und am 2026-04-08 ausdrücklich nicht beauftragt. Ein späterer Auftrag erfordert eine neue Vereinbarung.",
  "source": "prototype/context/quellen/kestenholt-auftrag-2026-04-08.md",
  "stand": "2026-04-08",
  "owner": "rolle:projektleitung",
  "scope": ["fall:CHANGE-01"],
  "status": "belegt",
  "synthetisch": true
}
