{
  "id": "kulanz-kest-2026-06-30",
  "kind": "fact",
  "statement": "Am 2026-06-30 wurden 1,5 PT für die Übernahme dreier Altdateien bei Kestenholt nicht berechnet. Grundlage war die Erwartung eines Folgeauftrags, nicht ein Vertragsanspruch. Geltung: dieser eine Vorgang.",
  "source": "prototype/context/quellen/kulanzvermerk-2026-06-30.md",
  "stand": "2026-06-30",
  "owner": "rolle:inhaber",
  "scope": ["fall:CHANGE-01"],
  "status": "belegt",
  "synthetisch": true
}
