{
  "id": "acc-kest-rechnungsnachweise",
  "kind": "acceptance",
  "statement": "Je Rechnung an Kestenholt gehören: Verweis auf die Bestellnummer 4711-Metall, vollständige Zeiterfassung des abgenommenen Umfangs je Task, Abnahmevermerk.",
  "source": "prototype/context/quellen/kestenholt-auftrag-2026-04-08.md",
  "stand": "2026-04-08",
  "owner": "rolle:projektleitung",
  "scope": ["fall:BILL-02"],
  "status": "belegt",
  "synthetisch": true
}
