{
  "id": "regel-kulanz-kein-anspruch",
  "kind": "rule",
  "statement": "Eine erteilte Kulanz begründet keinen Anspruch. Sie wird je Fall neu entschieden und bleibt Sache der Geschäftsführung. Der Hinweis eines Kunden auf das letzte Mal ist ein Prüfpunkt, keine Grundlage. Ein Kulanzvermerk eines anderen Kunden darf gegenüber diesem Kunden nicht genannt werden.",
  "source": "prototype/context/quellen/regelwerk-aenderungen-und-rechnungen.md",
  "stand": "2026-08-05",
  "owner": "rolle:inhaber",
  "scope": ["fall:CHANGE-01", "fall:CHANGE-02"],
  "status": "belegt",
  "synthetisch": true
}
