{
  "id": "abnahme-kest-modul1",
  "kind": "commitment",
  "statement": "Modul 1 von PRJ-KEST-1 ist am 2026-08-21 abgenommen. Rechnungsgegenstand sind die zum Modul 1 gehörenden Personentage.",
  "source": "prototype/context/quellen/kestenholt-auftrag-2026-04-08.md",
  "stand": "2026-08-21",
  "owner": "rolle:projektleitung",
  "scope": ["fall:BILL-02"],
  "status": "belegt",
  "synthetisch": true
}
