{
  "id": "agr-kest-modul2-abgrenzung",
  "kind": "agreement",
  "statement": "Modul 2 umfasst die Auswertung bereits im System erfasster Daten. Der Import von Fremddaten ist nicht Bestandteil des Auftrags.",
  "source": "prototype/context/quellen/kestenholt-auftrag-2026-04-08.md",
  "stand": "2026-04-08",
  "owner": "rolle:projektleitung",
  "scope": ["fall:CHANGE-01"],
  "status": "belegt",
  "synthetisch": true
}
