{
  "id": "agr-veld-modulumfang",
  "kind": "agreement",
  "statement": "PRJ-VELD-1 umfasst Wartungsportal für 240 Anlagen inklusive Übernahme des Anlagenbestands aus der Kundentabelle. Nicht enthalten: Anbindung an das Buchhaltungssystem des Kunden. Volumen 9 PT, Termin 2026-10-30.",
  "source": "prototype/context/quellen/veldt-auftrag-2026-05-19.md",
  "stand": "2026-05-19",
  "owner": "rolle:projektleitung",
  "scope": ["fall:CHANGE-02", "fall:BILL-01"],
  "status": "belegt",
  "synthetisch": true
}
