{
  "id": "zeiten-kest-luecke-2026-08",
  "kind": "fact",
  "statement": "Für 2026-08-19 bis 2026-08-21 sind 1,2 PT auf einem Sammelverbuchungsposten ohne Task-Zuordnung erfasst. Nachweislich zu Modul 1 gehören 5,8 PT; ob die 1,2 PT ganz oder teilweise dazugehören, ist nicht dokumentiert und entscheidet rolle:entwicklung.",
  "source": "prototype/context/quellen/zeiterfassung-auszug-2026-09.md",
  "stand": "2026-09-17",
  "owner": "rolle:entwicklung",
  "scope": ["fall:BILL-02"],
  "status": "belegt",
  "synthetisch": true
}
