{
  "id": "bestellnummer-kest-4711",
  "kind": "fact",
  "statement": "Die Bestellnummer von Kestenholt zu PRJ-KEST-1 lautet 4711-Metall und steht im Auftrag vom 2026-04-08.",
  "source": "prototype/context/quellen/kestenholt-auftrag-2026-04-08.md",
  "stand": "2026-04-08",
  "owner": "rolle:projektleitung",
  "scope": ["fall:BILL-02"],
  "status": "belegt",
  "synthetisch": true
}
